{
  "schema_version": "dependency-algebra.ast.v1",
  "topology_id": "minimal-valid",
  "source": { "source_id": "minimal-valid" },
  "components": [
    { "id": "client", "type": "entry", "metadata": { "tier": "edge" }, "source_location": { "source_id": "minimal-valid", "source_order": 0 } },
    { "id": "api", "type": "service", "metadata": { "tier": "app" }, "source_location": { "source_id": "minimal-valid", "source_order": 1 } },
    { "id": "db", "type": "store", "metadata": { "tier": "data" }, "source_location": { "source_id": "minimal-valid", "source_order": 2 } }
  ],
  "edges": [
    { "id": "client-api", "from": "client", "to": "api", "metadata": { "protocol": "https" }, "source_location": { "source_id": "minimal-valid", "source_order": 0 } },
    { "id": "api-db", "from": "api", "to": "db", "metadata": { "protocol": "tcp" }, "source_location": { "source_id": "minimal-valid", "source_order": 1 } }
  ],
  "workloads": [
    { "id": "serve", "roots": ["client"], "target": "db", "candidate_set": ["api"], "expected_classification": "NULL", "source_location": { "source_id": "minimal-valid", "source_order": 0 } }
  ]
}
